"Source: Nigeria Demographic and Health Survey, 2018",,,,,,,
,,,,,,,
"Percentage of de facto male and female household members age 15 and over in Niger State who have difficulty in functioning according to domain, and by highest degree of difficulty in at least one domain,
and percentage who have a lot of difficulty or cannot function at all in more than one domain, according to background characteristics",,,,,,,
,,,,,,,
"Prevalence of Various Domains of Functional Difficulty
in Men and Women in Niger State",,,,,Prevalence of Functional Difficutlies in Men and Women in Niger State,,
,,,,,,,
Domain of Functional Difficulty,Women,Men,,,Degree of difficulty,Women,Men
No difficulty in any domain,96.6,94.7,,,"Some
difficulty",3.2,4.8
Seeing,2.3,4.2,,,A lot of difficulty,0.2,0.4
Hearing,0.3,0.8,,,Cannot do at all,0,0.2
Communicating,0.7,0.6,,,A lot of difficulty or cannot do at all,0.2,0.6
"Remembering or
concentrating",0,0.6,,,A lot of difficulty or cannot function at all in more than one domain,0,0.3
Walking or climbing steps,0.9,1.4,,,,,
Washing all over or dressing,0.7,1,,,,,